,id,date,dateYear,dateMonth,dateDay,rating,userName,content
2145,2146,20170313,2017,03,13,4,Google 사용자,"유료기능은사용해보지않았어요.좋을것같은데,한달에5만여원은많은것같아서요.무료기능중에식사기록이좋았던것같아요.정확하게계산해주고,권장칼로리와얼마나다른지자동으로계산되거든요.만보기기능에칼로리소비량을계산해서한번에알려주면더좋을거같아요.좋은앱을만들어주셔서감사합니다"
2146,2147,20170305,2017,03,05,3,Google 사용자,저는 식사기록할때 g단위로 측정해서 숫자하나하나 찾기가불편해요 소수점도 다양하지않고 숫자  그냥 입력도 가능했으면좋겠어요!! 바꿔주시면그때다시와서 리뷰를 또한번 남겨보도록하지요
2147,2148,20170210,2017,02,10,5,Google 사용자,너무너무 좋아요 다이어트 앱으로 최고예요! 근데 새로운 음식을 입력해도 추가되지 않아 그게 조금 불편해요 ㅠㅠ 자주 먹는 음식이라 꼭 추가됐으면 하는 바람에 상세정보 입력까지 여러번 했는데 거절당하는 건지 아직 소식이 없네요오... 음식 업데이트 자주 해주셨음 좋겠어요! 항상 잘 이용하고 있습니다^^♡
2148,2149,20170322,2017,03,22,2,Google 사용자,원래 엄청 잘 썻었는데 업데이트 되고 로딩시간 너무 길어졌어요. 못쓰겠어서 지워요. 제발 로딩 시간 좀 줄여주시요. 너무 무거워졌어요 앱 자체가.
2149,2150,20170217,2017,02,17,5,Google 사용자,제 몸무계가 37인데 40부터 몸무계가 떠서 별로에요
2150,2151,20170217,2017,02,17,2,Google 사용자,매일 들어갈때마다 로그인을해야되는거 너무싫어요 ㅜㅜ
2151,2152,20170217,2017,02,17,4,Google 사용자,저기..저 어제 6개월만에 다시 기록시작했는데 왜 1월 22일에 69kg라고 적혀있는지요;;;; 제몸무게도 아닌데 왜 체중기록에 69kg라고 자동으로 적혀있는지 모르겠어요..지워주세요
2152,2153,20170303,2017,03,03,3,Google 사용자,신장/체중을 입력하는데 제한이 있어서 아쉬워요! 지금 나와있는 최소값보다 적은 수도 입력 할 수 있게 개선되면 좋을 것 같아요:)
2153,2154,20170305,2017,03,05,5,Google 사용자,기사보고 다운받았어요^^하루밖에 사용해보지않았지만 좋은 어플같아요 음식추가만 더 보완되었으면 좋겠어요^^
2154,2155,20170303,2017,03,03,5,Google 사용자,3개월간 15키로를 빼고싶어서 조정을 하고싶은데 어떻게 조정하는지 모르겠어요ㅠㅜ
2155,2156,20170220,2017,02,20,1,Google 사용자,아니 로그인도 안되고 가입도 안되서 어쩌라는건가요
2156,2157,20170308,2017,03,08,4,Google 사용자,목표체중을 설정할때 버그가 있는 듯 합니다 제 키가 178인데 적정 체중이 50킬로그램으로 나와요
2157,2158,20170306,2017,03,06,5,Google 사용자,살빼는데 기본적인 칼로리계산및운동량 체크에도움이되네요
2158,2159,20170310,2017,03,10,2,Google 사용자,돈 나가는지 몰랐음 저한테는 안맞네요 환불해주세요
2159,2160,20170311,2017,03,11,1,Google 사용자,팝업도 안뜨고 알림도 안되고 위젯누를때마다 로그인해야되고 이거뭐죠? 진짜쓰레기네요
2160,2161,20170305,2017,03,05,5,Google 사용자,조와요 살 쪽쪽 빼는중
2161,2162,20170224,2017,02,24,1,Google 사용자,아니 오랜만에 하려고들어갔는데 가입 경로가 세개나있는데 셋다 몇번을해도 오류라그러면 하라는거에요말라는거에요... 하..
2162,2163,20170216,2017,02,16,5,Google 사용자,진짜 다이어트하는데 최고입니다! 몇키로가 됬든 쑥쑥^^
2163,2164,20170219,2017,02,19,5,Google 사용자,이거 유튜브에 ' 여정을 떠난 여정 ' 2분 54초에 보시면 칼로리를 드레그 ? 해서 설정시키는게 있던데 제가 할땐 안돼거든요 . 어떻게 하는거에요 ??
2164,2165,20170221,2017,02,21,5,Google 사용자,예전에는 위젯에 칼로리표시도있지 않았나요?그거 좋았는데
2165,2166,20170217,2017,02,17,5,Google 사용자,하루에 물을 몇컵마셨는지 기록남기는 기능도있었으면좋겠어요
2166,2167,20170220,2017,02,20,5,Google 사용자,정말 좋아용!! 실제 다이어트 하는데 도움이됬지요~ 학생이라 돈으로 하는건 못하지만 칼로리기록하는거랑 운동기록하는것만으로도 큰도윰이 됬어요~ 최고의 앱!!😆😆
2167,2168,20170313,2017,03,13,3,Google 사용자,로그인을 한번만 하면 다음번부터는 자동로그인되는 기능은 없나요?
2168,2169,20170316,2017,03,16,2,Google 사용자,로딩 시감이 왜르케 길어졌어여??업데이트 괜히함..ㅠ
2169,2170,20170214,2017,02,14,1,Google 사용자,탈퇴부탁드려요
2170,2171,20170314,2017,03,14,5,Google 사용자,추천!!!
2171,2172,20170309,2017,03,09,5,Google 사용자,엄청 좋아요
2172,2173,20170212,2017,02,12,5,Google 사용자,너무 좋아요
2173,2174,20170210,2017,02,10,5,Google 사용자,좋아요
2174,2175,20170304,2017,03,04,5,Google 사용자,좋습니다
2175,2176,20170215,2017,02,15,5,Google 사용자,너무좋움
2176,2177,20170207,2017,02,07,2,Google 사용자,코치 기대 갖고 신청했는데 상담을 통한 관리 엄청 선전해놓고 고객이 보낸 선톡도 씹고 이게.뭐죠?? 어떻게 진행된다는 최소한의 안내도 없고요. 한달에 5만원 넘으면 헬스비보다 비싼건대. 환불원합니다. 고객센터로 요청해뒀으니 빠른처리 부탁해요.
2177,2178,20170203,2017,02,03,3,Google 사용자,헬스같은 운동없이 식단위주로 하는 사람이다보니 무료로 사용하는것과 큰 차이가 없는 것 같습니다.. 환불 신청합니다
2178,2179,20170207,2017,02,07,3,Google 사용자,잘못눌렀는데 결제가되버림ㅡㅡ 환불어떻게하는거야ㅡㅡ 빨리해줘요
2179,2180,20170131,2017,01,31,5,Google 사용자,그램단위 되요. 예전처럼 자모양은 아니지만 자세한칼로리확인하기인가 우측하단누르면 g으로도 가능해요 ㅋㅋㅋㅋ
2180,2181,20170129,2017,01,29,3,Google 사용자,그램 단위로 계산하게 해주세요ㅠㅠ
2181,2182,20170216,2017,02,16,5,Google 사용자,4년째 평생회원으로 쓰고있습니다. 식단관리에 많은 도움받습니다.
2182,2183,20170129,2017,01,29,5,Google 사용자,좋네요 저 한달 5킬로 감량
2183,2184,20170206,2017,02,06,1,Google 사용자,첫달에 결제하고 도움이 안되서 이용 안하고 있었는데 방금 자동결제가 됐네요 당장 환불해주세요
2184,2185,20170206,2017,02,06,5,Google 사용자,다이어트에 도움이되는데 한가지 아쉬운점은 찾고 자 하는 음식이 많이없어서 아쉬워요
2185,2186,20170201,2017,02,01,5,Google 사용자,음..제가 원래160에48이였는데 이제 교복을입어야되서 다이어트하려고 이 입을깔고 하루에 1200칼로리씩먹고 운동하고 한... 한달쯤?? 하니깐 3Kg빠져서 45됬어요♥♥진짜 넘나좋은것 하지만 제목표는 43이기때문에 더 열심히 식단조절과 운동해야겠네용♥
2186,2187,20170125,2017,01,25,3,Google 사용자,이거 그램단위로 칼로리 계산 못하나요? 되면 5개였을텐데..
2187,2188,20170206,2017,02,06,2,Google 사용자,그닥...도움되진않네요 환불원합니다
2188,2189,20170201,2017,02,01,5,Google 사용자,진짜 사용하기 좋아요!!!
2189,2190,20170130,2017,01,30,5,Google 사용자,도움진짜많이됨
2190,2191,20170205,2017,02,05,3,Google 사용자,혹시 코치는 정해서 할순 없나요??
2191,2192,20170121,2017,01,21,5,Google 사용자,다른 건 다 좋은데  구글 피트니스 (Google Fit) 과 연동하면 앱이 오류가 나고 꺼집니다. 그 후에도 계속 작동이 안 됩니다. 지난 1주일간 아무 문제 없었는데 프로그램 개시 이후 첫 주말에 이런 문제가 생기네요. 시스템 로그 포함해서 오류 정보를 전송했습니다.
2192,2193,20170114,2017,01,14,4,Google 사용자,다이어트시 중요한 기록들을 할 수 있어 유용하고 좋아요 그런데 자꾸 운동기록에서 요가가 운동계획으로 넘어가는 오류가 생기더라구요ㅠ 그리고 음식기록 데이터 베이스가 좀 더 자주 업데이트 되었으면 좋겠네요!
2193,2194,20170107,2017,01,07,3,Google 사용자,오늘은 토요일인데 베터리 갈아끼고나니 금요일에 오늘이 되어있고 식사도 걸음도 어제 저녁 데이터쯤으로 돌아갔네요. 기억력이 안좋은데.. 오늘 먹은거 기록하려고해도 토요일이 아니라고 나오니 방법이 없네요. 어째야 하나요? 이렇게 오류가 자주난다면 4개월을 어찌 신뢰하죠?
2194,2195,20170121,2017,01,21,1,Google 사용자,잘쓰고있었는데 갑자기 삭제했다 깔아도 그냥 계속 중단됐다고 뜨네요 . 들어가자마자 바로요 . 어떻게 좀 해주세요 .
2195,2196,20161229,2016,12,29,5,Google 사용자,저는 오류도 없고좋더라고용.음식칼로리도 나오고 하루권장량 칼로리도 나와서 음식을 조절하게되더라고요.음식조절만하니 한달?두달?정도 되니 5키로정도빠지고 운동도하면 정말잘빠질듯.이앱으로 음식조절하고 운동도하니 살도 잘빠지공.정말 좋은거같아요.체중기록할때마다 계속 빠지고있어서 뿌듯! 목표체중을 위해 모두들 화이팅!!앱 감사합니다ㅠ
2196,2197,20170113,2017,01,13,4,Google 사용자,다이어트 일기를 손으로 직접 쓰고 있었는데 따로 쓰지않아도 되고 음식 무게당 칼로리를 알 수 있어서 그게 제일 좋아요 근데 하루마다 추가란에 메모도 기입 해주셔서 간단히 하루일과를 쓸 수 있게 해주시면 더 좋을 것 같아요
2197,2198,20170112,2017,01,12,5,Google 사용자,원래 이런 평 쓴적도없고 안쓰는데 넘 좋아서 ㅜㅜㅜ 잘 쓰고 있습니다 !!
2198,2199,20170116,2017,01,16,3,Google 사용자,제가 원하는 방향으로 다이어트를 하는데 도움이 안되는것같아서 환불처리부탁드립니다ㅠㅠㅠ 문의메일도 이미 보냈습니다!
2199,2200,20170116,2017,01,16,1,Google 사용자,식단입력할때마다 자판이 안쳐져요 코치님과 채팅이나 다른건 괜찮은데 잡곡밥이면 ㅈ ㅏ ㅂㄱ ㅗ ㄱ ㅂ ㅏ ㅂ 이런식으로 귀찮아죽겠어요 사진 보내드릴것도없어요 저말 그대로에요
2200,2201,20170130,2017,01,30,2,Google 사용자,환불했는데  계좌로 입금이 안되네요 확인부탁드려요
2201,2202,20170114,2017,01,14,1,Google 사용자,여름부터 시작할려구 하는데 환불좀해주세요
2202,2203,20170102,2017,01,02,5,Google 사용자,덕분에 다이어트 편하게 할수있어서 너무좋네용 감사합니당
2203,2204,20170113,2017,01,13,5,Google 사용자,"12월 14일 이후로 다이어트를 포기하고 어플을 지웠는데, 자동연장 되었네요. 1월 이용료는 환불 부탁드립니다."
2204,2205,20170124,2017,01,24,3,Google 사용자,갑자기 앱이 중지됐다고 하면서 안되요. ㅠㅠ 지우고 다시 깔았는데도 안되요ㅠㅠㅠㅠㅠ
2205,2206,20170115,2017,01,15,5,Google 사용자,다이어트 하시려고하는 분들이나 그냥 적절하게 운동하시려는분 모든분들께 추천해드리고 싶어요! 진짜 좋아요 먹어야 되는칼로리 먹어도 되는칼로리 내가먹은칼로리가 다 나와서 좋은거같아요 진짜 강추입니다😀
2206,2207,20170120,2017,01,20,1,Google 사용자,자꾸오류잇다고떠서 지우고 깔고를반복중
2207,2208,20161226,2016,12,26,1,Google 사용자,최악의 불안정 앱
2208,2209,20170124,2017,01,24,5,Google 사용자,식단기록도 편하고 다른앱에는 없는 음식들이 많은데 음식도 다양해서좋아요!
2209,2210,20170119,2017,01,19,4,Google 사용자,다 좋은데 식사 기록을 기록할 때 이상하게 오류가 생기네요...  이것만 수정되면 완벽한데..
2210,2211,20170114,2017,01,14,2,Google 사용자,수정하려고 해도 '저장' 대신 휴지통 버튼이 있음... 그리고 운동 계획 짤 때 요일 지정을 한꺼번에 할 수 있었음 좋겠습니다. 눔은 어째 갈수록 별로가 되어가나요... 복잡하고 정신없고... 쓸 거 없어서 쓰긴 하는데 진짜 너무 실망스러워요.
2211,2212,20170124,2017,01,24,4,Google 사용자,앱자체는 문제없는데 좀.. 비싼거같네요 저 자동 결제 해지좀 부탁드립니다..
2212,2213,20170102,2017,01,02,4,Google 사용자,환불100이라 그러셨죠
2213,2214,20170110,2017,01,10,5,Google 사용자,방금 결제 했는데 앱에 들어가지지도 않고 계속 동그라미만 몇십분째 돌아가는데 작년에 잘 썼던 기억이 있어서 결제했는데 당장 환불해주세요
2214,2215,20161229,2016,12,29,1,Google 사용자,새폰으러 바꿔서 최신버전으로 깔앗더니... 자주해먹는 음식 기록란이 왜 사라졌나요?자주해먹는 음식 만들때마다 번거롭게 하나하나 입력해야하나요? 아니면히스토리를 하나하나 번거롭게 찾아가서 넣어야하나요? 이해가안갑니다... 허리둘레란도 없어졋네요..
2215,2216,20170125,2017,01,25,4,Google 사용자,다 좋은데 앱이 안열리는 문제가 있네요
2216,2217,20170101,2017,01,01,4,Google 사용자,돈안들이고도 질병관련 관리해주시면 진짜 더 좋을텐데
2217,2218,20170112,2017,01,12,4,Google 사용자,레쓰비 커피나 로터스 비스켓 엄청단거 먹엇는데 둘다 초록색 음식이라고 잘했다는데 기준이 뭔가요 둘다 다이어트때 피해야할 음식아닌가요
2218,2219,20170120,2017,01,20,2,Google 사용자,오류 너무나네요..ㅡㅡ 오류나는것만빼면 정말좋을듯
2219,2220,20170117,2017,01,17,5,Google 사용자,운동 종류에서 점핑피트니스도 추가해주셨으면 좋겠습니당!! 요즘 한창 뜨고 있는 운동인데 스피닝만 있고 없네용ㅠㅠ부탁드려요!!!♡
2220,2221,20170104,2017,01,04,1,Google 사용자,하루동안 재시도 해봤는데 서버와의 통신이 지연된다며 가입이 안되네요...
2221,2222,20170121,2017,01,21,4,Google 사용자,오류로 엡실행이 되지않습니다 삭제했다가 재설치해도 같은 증상   처리방법이 없네요
2222,2223,20170112,2017,01,12,2,Google 사용자,코치도 빨리 배정안되구ㅜㅜ식단이나 운동정보도 어떻게 받아야하나 잘 모르겠어요ㅠ무엇보가 정기결재인걸 모르고 해서 환불받고싶은데......어떻게하나요?
2223,2224,20170102,2017,01,02,3,Google 사용자,최초에 기록한 운동을 빼고 나머지는 운동기록이 아니라 운동 일정 설정으로 들어가서 불편하네요
2224,2225,20170117,2017,01,17,4,Google 사용자,어제까지는 아무 문제없이 잘 썼는데 오늘 식사기록 하려니 데이터베이스 오류라면서 음식목록이 안 뜨네요
2225,2226,20170120,2017,01,20,5,Google 사용자,음식을 체크하면서 먹을 수 있어서 과식하지 않게되고 조절해가면서 먹을 수 있어서 좋아요^^!
2226,2227,20170124,2017,01,24,1,Google 사용자,갑자기 들어가지지 않아요ㅜㅜ
2227,2228,20170120,2017,01,20,4,Google 사용자,식사별말고 시간대별로 음식기록하게해주세요
2228,2229,20170125,2017,01,25,2,Google 사용자,계속앱이 중단됐다고 떠서 사용하질 못하고있어요..
2229,2230,20170109,2017,01,09,3,Google 사용자,그 g수로 칼로리 나타내는거 어떻게 하는건가요
2230,2231,20170121,2017,01,21,5,Google 사용자,칼로리 확인도 쉽고 짱짱
2231,2232,20170112,2017,01,12,1,Google 사용자,환불해주세요.. 일하느라 코치님과 대화할수잇는시간이 전혀맞질않네요..
2232,2233,20170102,2017,01,02,4,Google 사용자,왜 체크가 안넘어가요?
2233,2234,20170105,2017,01,05,3,Google 사용자,'눔 정보를 이메일로 보내기'가 왜 안되나요...
2234,2235,20170110,2017,01,10,5,Google 사용자,알림창에 7일간뜨게설정해도 재부팅하면 자동으로뜨지않고 제가 눌러줘야 뜨는데 다른설정법있는지요
2235,2236,20170117,2017,01,17,5,Google 사용자,죄송했습니다.정신이 나갔었나봐여...
2236,2237,20170104,2017,01,04,4,Google 사용자,일리리 손으로 돌려야 해서 힘드네요
2237,2238,20170118,2017,01,18,5,Google 사용자,꼭 경험하고 싶은....
2238,2239,20170102,2017,01,02,1,Google 사용자,♡정말   짱!짱!짱!이에염♡
2239,2240,20170116,2017,01,16,5,Google 사용자,너무좋다
2240,2241,20170111,2017,01,11,5,Google 사용자,최고에요
2241,2242,20170119,2017,01,19,5,Google 사용자,좋아요
2242,2243,20161222,2016,12,22,3,Google 사용자,앱에서 프로그램 아이디 등록 후 구글계정으로 로그인하려고하는데 서버와 연결이 안된다면서 자꾸 오류가납니다...어떻게 해야되나요
2243,2244,20170913,2017,09,13,4,Google 사용자,다 좋은데요..식사 기록할 때 왜 어제까지만 해도 검색하면 있던 음식이 오늘 검색하면 안나오죠ㅡㅡ..정말 답답해요..잘못 본 게 아니라 어제 검색할때는 분명히 있던 우유가 오늘 검색하면 안나오고.. 왜 그러는 거에요?
2244,2245,20161220,2016,12,20,4,Google 사용자,매일 꾸준히 똑같은 운동하려고하는데 매일 설정하는 기능은 없고 하루하루 따로따로 기록하는것밖에 없더라구요ㅜㅜ 매일설정으로 되어있으면 좋겠어요 ~
2245,2246,20170201,2017,02,01,5,Google 사용자,다이어트를 할때 상당한 도움이 됩니다.
2246,2247,20170220,2017,02,20,5,Google 사용자,다이어트 할때마다 필수어플
2247,2248,20170406,2017,04,06,5,Google 사용자,아 개좋아
2248,2249,20161218,2016,12,18,3,Google 사용자,한동안 눔 다이어트 구독을 쉬려는데 구독관리 접속이 안되어 결제를 차단할수가 없네요. 덕분에 이번달 구독금액도 자동이체 되었고요.2017년1월 16일이후 결제차단 부탁드립니다.
2249,2250,20161213,2016,12,13,4,Google 사용자,신용카드 분실한적이 있어 그런가보다 했는데 업데이트 후에도 계속 그러네요 코치와 그룹기능도 없어지구요  눔 앱의 도움말 코너통해 보내긴 했는데 빠른조치 부탁드려요  YEPZ-MX6Z  가 접로속코드입니다 가입한 네이버 이메일로 답신 바랍니다
2250,2251,20161210,2016,12,10,3,Google 사용자,이미지 불러오는것 때문인지 로딩이 느려요. 심지어 미션 이미지도 표시가 안됩니다. 그룹도 글 다운로드 오류라고 뜨고 그룹원 보려고하면 프로그램 강제 종료 돼요
2251,2252,20161218,2016,12,18,1,Google 사용자,잘되다가갑자기아무것도안되네요.음식칼로리재는거자꾸뭐가문제있다고하고안뜨고업데이트때문인것같은데요
2252,2253,20161210,2016,12,10,1,Google 사용자,페이스북계정 로그인은 서버연결때문에 안된다함. 메일로 로그인은 비번확인없이 자동으로 설정이라 내가 틀린것도 몰라서 로그인이 어려움
2253,2254,20161219,2016,12,19,3,Google 사용자,저는 무료앱인줄 알고 왜 이렇게 좋지 하다가 알게 된 사실은 유료★
2254,2255,20161212,2016,12,12,1,Google 사용자,구입한지 몇일째 지나도 코칭연락도 안오고 문의메일쓰기하려고 메일 누르면 화면에러 뜹니다 왜그런가요.
2255,2256,20161213,2016,12,13,1,Google 사용자,4년동안 써오던 앱인데 업데이트 이후에 실행도 안되네요 개선해 주세요
2256,2257,20161129,2016,11,29,3,Google 사용자,운동같은경우 강도 높은 운동 선택하면 그안에 어떤 운동을 했는지 메모할 수 있는 칸이 있으면 좋겠습니다. 또 도움말검색하다 뒤로가면 바로 다시 홈화면이 나와서 불편합니다
2257,2258,20170505,2017,05,05,2,Google 사용자,업데이트 후에 다이어트플랜 다시시작하기 없어져서 불편해요.. 다시 고쳐주세요ㅠ
2258,2259,20161201,2016,12,01,2,Google 사용자,한번도 오류이렇게 난적이 없었는데요. 평생회원인데 새로운아이디로 눔코치 써보다가 아니다 싶어서 다시 전 계정으로 갈아탔습니다. 그 이후로 부팅도 오래걸리고 무엇보다 전에 기록햇던 체중그래프가 안뜨더라고요. 굉장히 만족하고 쓰다가 괜히 눔코치 때문에 하.....짜증나서 못쓰겠네요.
2259,2260,20161130,2016,11,30,3,Google 사용자,오류가 떠서 눔어플이 안열리네요 ㅠㅠ
2260,2261,20161127,2016,11,27,5,Google 사용자,초등학생들도 건강을 챙길 수 있어서 좋은 것 같아여...암튼최공~ㅎㅎ   ;-)   :-)
2261,2262,20161207,2016,12,07,1,Google 사용자,개인사정으로 앱 사용 불편으로 환불 원합니다.
2262,2263,20161201,2016,12,01,5,Google 사용자,잘되어있는듯
2263,2264,20161130,2016,11,30,4,Google 사용자,그런데 프로그램 할때 다 돈내야하네요    학생이라 결제를 못하는데 무료 프로그램은 없나요?
2264,2265,20161202,2016,12,02,5,Google 사용자,소셜식으로 메뉴입력해가는것도 좋구 필요한 기능만 잇어서 조아요
2265,2266,20161204,2016,12,04,4,Google 사용자,하루섭취칼로리를 스스로 조정할수있게 해주세요.
2266,2267,20161121,2016,11,21,5,Google 사용자,지난 금요일부터 식단기록항목이 사라졌어요 왜그럴까요?ㅠㅠ 너무 유용하게 잘 쓰고 있었는데ㅠ
2267,2268,20170110,2017,01,10,4,Google 사용자,자동결제 해지부탁드려요
2268,2269,20161122,2016,11,22,5,Google 사용자,저랑 운동방식이 안맞는거 같아요 자동결제아니죠?
2269,2270,20161129,2016,11,29,5,Google 사용자,식단관리하기에 편리합니다.
2270,2271,20161120,2016,11,20,5,Google 사용자,처음 화면이 뜨는데 시간이 오래 걸려요 동그라미가 뱅뱅 돌아요 식사 입력해도 반영되는데 시간이 오래 걸립니다ㅠㅠ 다시 지우고 깔아봤는데도 그러네요
2271,2272,20161208,2016,12,08,2,Google 사용자,정확한음식단위봐도 그램수로 칼로리나오는건없는데요?
2272,2273,20161208,2016,12,08,3,Google 사용자,처음에 로그인하는데  계속 오류나요
2273,2274,20161123,2016,11,23,3,Google 사용자,없애셨나요 아님 오류인가요?
2274,2275,20161120,2016,11,20,5,Google 사용자,정말짱이에요
2275,2276,20161204,2016,12,04,5,Google 사용자,굿
2276,2277,20161123,2016,11,23,2,Google 사용자,환불어떻게하조?
2277,2278,20161024,2016,10,24,3,Google 사용자,작년 이맘때 한달만 결제했는데... ㅜ 이게 한달끝나면자동결제되는줄모르고 1년이나 지났네요 ㅜㅜ 구독취소해주세요
2278,2279,20161115,2016,11,15,5,Google 사용자,활용하기 나름이지만 다이어트하면서 음식 칼로리 보고 얼마나 많이 먹었나 알수있고 다이어트의 의지를 더욱 불태우게해주는거 같아요~
2279,2280,20161201,2016,12,01,1,Google 사용자,최신 업그레이드 후 로딩중만 뜨고 초기 화면 접속이 1분 이상 걸립니다. 다행히 이전버전을 백업해 둬서 임시로 이전버전으로 되돌리니 정상 작동합니다. 물론 글 읽을때는 이전 버전도 글은 바로 뜨지만 로딩중이 오래도록 떠 있네요. 로딩중이 사라질 때까지 메인화면으로 돌아갈 수가 없습니다. 무한 로딩중 현상 발생한 업데이트 후 일주일이 넘었는데 아직도 최신 업데이트가 안뜨고 있네요. 신속한 해결 부탁드립니다. 어플을 사용할 수가 없네요. 이젠 불안해서 업데이트도 함부로 못하겠고 백업 후 해야겠네요...
2280,2281,20161006,2016,10,06,4,Google 사용자,음식종류도많고 간단해서 쓰기좋은데 한가지 불편한게 음식 그램 수를 직접 썼으면좋겠어요 그램수맞출때까지 손가락으로 계속 올리는게 불편해요 이 점 개선부탁드립니다!!
2281,2282,20161108,2016,11,08,4,Google 사용자,한가지 제안하자면 눔워크와 연동되니 걸음수에 따른 칼로리 소비양이 표기되면 좋겠어요. 그러면 운동하는데 더욱 동기부여가 될듯합니다.
2282,2283,20161019,2016,10,19,5,Google 사용자,"자동으로 만보 걸을수 있도록,  목표가 조절된다고 알고있고,  설명도 그렇고 예전에 쓸때도 분명 그랬는데 최근 다시 사용중인데 2달째 목표가 그대로에요."
2283,2284,20161006,2016,10,06,4,Google 사용자,오늘 기록 하려고 하는데 페이지가 아예 안뜨네요.. 어제를 누르면 식사기록  만보기 등이 뜨는데 오늘화면은 그냥 회색입니다. 바로바로 열심히 기록중이였는데..  답답해요ㅠ
2284,2285,20161011,2016,10,11,3,Google 사용자,음식 그램수 잴때 다른 분들은 다 알아서 잴 수 있는거 같던데 제꺼는 .5 .25 .75 이렇게만 할 수 있더라고요 어떻게 해야 그램수를 정확히 잴수 있나요 ?
2285,2286,20161110,2016,11,10,5,Google 사용자,칼로리체크해주는것도 편하구ㅎㅎ 좋은앱인것같아여
2286,2287,20161108,2016,11,08,3,Google 사용자,어제설치하고 화이팅하고자했었는데 갑자기 오늘일정넘어가면서 만보기 기능이없어져서요 환경설 정도 그렇고  지웠다가다시설치해도 다른계정만들어도 만보기가없네요 어떻게해야할까요?
2287,2288,20161005,2016,10,05,1,Google 사용자,비밀번호재설정까지했는데 왜자꾸오류뜨죠 답답해서못하겠네요;
