,id,date,dateYear,dateMonth,dateDay,rating,userName,content
689,690,20200903,2020,09,03,1,나나,"칼로리 관리랑 운동 기록하는 게 다른 어플들보다 좋아서 잘 사용하고 있었는데, 결제 안 하면 그것도 이용할 수 없게 됐네요... 아쉽습니다 눔은 이제 삭제해야겠네요..."
690,691,20210620,2021,06,20,1,다다,앱이 제대로 작동도 안하고 ㅡㅡ 결제 알림도 없이 결제하시나요 취소요청했는데도 결제한것도 어이없고요 ㅡㅡ 빨리 환불해주세요
691,692,20210222,2021,02,22,1,신혜정,취소처리가 안되고 결제가 계속 들어오는 뭐이런게 다있나요 메일을 수회 보냈는데도 답도 없네요 빨리 처리해주세요
692,693,20200505,2020,05,05,5,누네띠네,다이어트 습관을 잡는데는 최고입니다! 작심3일에 무너디셨던 분들은 꼭 한번 이용해보길 추천드려요^^
693,694,20190805,2019,08,05,4,Google 사용자,시작한지 얼마되지는 않았지만 꾸준하게 할 수 있을 것 같아요. 누군가 날 코칭해주고 여럿이 공유하니 더 쉬운 것 같아요!
694,695,20200414,2020,04,14,5,Google 사용자,두달의 여정기간동안 식단기록과 가벼운운동만으로도 체중감량의 효과를 봤네요. 굿
695,696,20200803,2020,08,03,1,목캔디,"코칭쌤 맘에 안들어서 바꾸고 싶은데, 평가 안좋게 줘도 계속 기계적인 답으로 코칭하네요. 한번 정해진 코칭 선생은 바꿀 순 없나요? 할맛 안나서 돈만버리고 있네요"
696,697,20191124,2019,11,24,4,Google 사용자,지금 현재 두달 넘게 하고있는 사용자입니다. 좋은점은 식단 관리를 할수있어서고 두번빼는 코치님에게 직접 물어볼수있는것이 좋았습니다 그리고 단점은 시간대가 맞질않아 눔코치와의 대화가 끊긴다는점이 아쉬웠어요 그래도 좋은점은 제가 주간 야간을 도는 일을하는데 그걸 잘 기억해주시고 운동은 어떻게 진행했는지 그리고 운동 강도는 어땠는지 못했어도 격려해주는것에 대한것은 정말 좋았습니다 다만 제가 초반에 바로잡지못해서 식단관리도 안하고 그냥 한끼만 먹어버리고 그랬었습니다 그리고 그때에는 전혀 대화가없었습니다. 한달뒤에 이대론 안되겠다싶어서 코치님에게 직접 물어보고 할려는 의지가 생기는 그때부터 코치님이 그제서야 잘 대해주시는거같았습니다.(개인적인생각입니다) 하지만 아쉬운점은 응원 정도만 해주시는게 너무아쉬웠습니다. 제가 바라는건 예를들면)식단 1주 식단을 어떻게해야할지몰라 알려달라고했을때에 대한 답변 같은것들입니다..
697,698,20210105,2021,01,05,5,군고구미,4개월동안 했고 10.1키로 감량했어요 ! 살면서 이렇게 많이 빼본건 처음이네요 ㅎㅎ 다행히 코치님도 좋은분으로 배정 받아서 도움많이받았습니다
698,699,20210128,2021,01,28,5,Lee Bethania,눔은 지속가능한 다이어트 관리를 위한 최고의 프로그램입니다. 단기체중 감량 후 뒤따르는 요요현상 없이 건강하게 감량한 후 건강하게 유지하게 하고 건강을 증진시키는 좋은 습관을 갖게 해주는 최고의 체중감량 건강 지키미!
699,700,20211023,2021,10,23,5,화나게하지마,"인스타그램 광고로 우연히 가입해서 천원으로 일주일 서비스 받아봤는데 생각보다 도움이 많이 되었어요,특히 전*빈코치님이 제 눈높이에 맞춰 상담을 해주시고 좋게 말씀해주셔서 감동했습니다 ㅎㅎ 고작 일주일 했지만 그 사이에 기록하는 습관이 생겨서 좋아요 :)"
700,701,20191102,2019,11,02,2,Google 사용자,없는음식이 많고 있는음식도 기준이 모호한게 많아요 그리고 무엇보다 앱 접속이 안됨ㅋ
701,702,20190210,2019,02,10,2,Google 사용자,페이스북 로그인이 되지 않습니다. 서버와 연결할 수 없다는 코멘트가 일주일이 넘었는데 아직도 서버연결이 안되네요. 갤럭시9 S+ 모델입니다
702,703,20210419,2021,04,19,1,youngran park,1000원내고 체험하는 프로그램 신청했는데 문자온 아이디로 가입하려고했는데 계속 안된다고 하네요 오늘 전화 다시 주신다면서요?.연락없네요 그냥 취소해주세요. 가입아직 안된상태인데여 1000원 체험 끝나고 결제예정이라고 제 카드 번호 다 적었잖아요? 빨리 탈퇴해주세요!
703,704,20210430,2021,04,30,5,소망은혜해련,체험판사용자입니다. 다이어트 식단관리하는데 유용한앱입니다. 추천할정도로요~!!!^^
704,705,20220116,2022,01,16,4,헤헤헷,운동기록 잘못입력했을때 수정하기가 안됩니다 안드로이드도 업데이트 해주세요ㅠㅠ
705,706,20200815,2020,08,15,5,홍수진,코치가 매일 코칭해주시고 그룹에서도 응원받아서 동기부여가 확실한듯요 다이어트 여러가지 해 봤지만 눔은 천천히 건강하게 살 뺄수 있을거 같네요 아직 시작한지 얼마 안 됐지만 만족이요
706,707,20201003,2020,10,03,1,dapci ya,뭐 어쩌라는 건지;;; 앱 들어갔는데 몇년전 깔았다 지운후 다시 깐거라 계정 다 만들고 홈에 가려는데 무슨 프로그램 어찌고 되지도 않는데 계속 하라네요;;; 계속 아이디도 없는데 아이디 치라하고 뒤로가기 하나도 안되고;;;;;;;;;; 왜 이러는거죠 쫌 많이 짜증나네요;
707,708,20191130,2019,11,30,5,Google 사용자,"심리적,신체적.정신적으로 도움되는 앱입니다 덧붙여 체중감량까지~~"
708,709,20200527,2020,05,27,5,최선희,자신을 자주 정비할수 있어서 좋네요 몰라서 안 하는게 아니고 알면서도 하기어려운게 다이어트 니까요
709,710,20201013,2020,10,13,5,김연태,건강한 음식을 먹으며 그날 그날 미션따라 운동을하면서 살빠지고 있어요 좋은 친구를 만난 느낌이여서 요즘 행복하답니다~ 룸 쭈욱 함께 하고파요
710,711,20200408,2020,04,08,5,Google 사용자,안녕하세요 잘 쓰고있는데 왜 쓰다보면 일본어가 나오는건가요 한국어로 잘 나오다가 가끔그래요
711,712,20200325,2020,03,25,5,Google 사용자,다이어트 원한다면 한번 해보는것도 좋은듯!! 일단 식단을 매일 쓰기땜에 먹는걸 신경쓰게됨
712,713,20210502,2021,05,02,5,심효준,"일주일 사용후기 - 정보와 동기부여, 적절한 응원까지. - 운동 및 식이 점검으로 비대면 프로그램으로써 매우 훌륭함"
713,714,20200306,2020,03,06,1,Google 사용자,눔 로그인이 안되어서 결제를 했음에도 계속 이용하지 못하고 있습니다. 메일로도 요청했는데 답이 없네요 ㅠㅠ
714,715,20190807,2019,08,07,4,Google 사용자,사용도편하고 좋아요 단 걷기 카운팅이 제대로 되지않는경우가 있어요
715,716,20200802,2020,08,02,3,김칠리,프로그램은 좋은데 어플 오류가 너무 심해요 저만 유독 그런 건가요? 매번 인증 올릴 즈음에 어플이 안들어가져요... 저녁 내내 접속 시도하다가 결국 이 새벽에야 미션글을 올리는데 혹시 인정 안돼서 환급 못받으면 어쩌지 싶어지네요... 환급 못받아도 건강챙겼으니 됐지 하고 넘기고 싶은데 한두푼도 아니고 어플 오류로 미션클리어를 못한 거라 억울한 마음이 드는 건 어쩔 수 없나봐요 그리고 오류로 미션 진행 안되는 게 이번이 처음도 아니란 말예요ㅜㅜㅜㅜ... 스트레스.....
716,717,20200407,2020,04,07,5,Google 사용자,"눔을 시작하면서 식단, 체중, 운동을 기록하게 되니까 자연스럽게 생활습관이 바뀐 것 같아요!"
717,718,20181218,2018,12,18,2,Google 사용자,머니백 7일 이내 환불요청합니다. 너무느리고 바쁜와중에 해야되는데 불편한 것 같습니다. 환불에 대해서도 불편하네요
718,719,20200229,2020,02,29,5,Google 사용자,걸음 수 측정이 자동으로 안되는게 아쉽지만 그외에 부분은 다 만족스러워요!
719,720,20200201,2020,02,01,1,Google 사용자,가입하기해서 가입할 아이디 입력했는데 유효하지않는 아이디래요.......구글이랑 페이스북으로도 가입이안되네요
720,721,20210125,2021,01,25,1,Y S,결제까지 마쳤는데 개인정보 다운에 오류가 발생했다면서 아무것도 되지않음...이게뭔..
721,722,20191022,2019,10,22,4,Google 사용자,좋아요 다이어트 뿐 아니라 건강 관리에 도움이 되었어요^^4개월간 잘 관리 했습니다
722,723,20200128,2020,01,28,5,Google 사용자,똑똑하게 다이어트 하고싶은분들은 꼭 이용 추천드려요~ 덕분에 4달동안 건강하게 7키로 감량했답니다🤗
723,724,20210318,2021,03,18,2,박선영,2일사용해봤ㅁ는데...그냥그랬음 그리고 천원으로 1주일사용료라면서 1599원 빼감..ㅡㅡ;;해외수수료라나...도둑놈들...처음부터 잘 명시를 해놓던가 짜증나서 취소합니다.
724,725,20190802,2019,08,02,4,Google 사용자,건강한 다이어트를 할 수 있도록 도움을 줍니다 많은 정보와 운동방법을 알려주며 격려와 힘을 줍니다
725,726,20201201,2020,12,01,5,김서희,첫 다이어트 유료 어플이어서 그런건디는 모르겠지만 다른 다이어트 어플들에 비해서 더 관리해주는 느낌이에요 ㅎㅎ
726,727,20210608,2021,06,08,1,Eunju Lee,취소하는게 너무나 복잡하고 어려운듯하네요.. 제꺼 취소해주세요.
727,728,20201026,2020,10,26,1,김한나,진짜 웬만하면 쓴소리안하고 어플만들분들 애쓰시겠거니 해서 좋은소리만하는데요 개인코치라는분이 문자?를하는데 5분만에답장해도 1시간이 넘어야 답장하나 받을수있어요 처음인데도말이죠 아마 계획하나 세울려면 1주일은 걸릴듯하네요 최악입니다 차라리 무료 다이어트 어플이 훨씬 효율적이고 좋았습니다 진짜로 정말로 최악입니다
728,729,20200216,2020,02,16,2,Google 사용자,2주 정도 사용하고 있었는데 현재 걸음수 확인이 안되고 계속 0 이에요 만보기가 작동을 안해요
729,730,20210412,2021,04,12,1,박소희,1주일 체험 신청하고 결제 후 식사 1끼 등록 후엔 채팅에 코치 답글도 보이지 않더니 이제는 아예 어플이 구동되지 않네요. 1주일 체험 후 만족하면 큰맘 먹고 결제하고자 했는데 기본적인 구동도 안되는 시스템이라면 체험하기 비용 천원도 환불 요청드립니다.
730,731,20210103,2021,01,03,1,박재향,작년 8월이후로 사용안하고 있다가 어제 179000원가량이 자동결제가 갑자기 되서 놀랐습니다 적어도 몇일뒤에 자동결제 된다고 메세지라도 보내주셔야 되는거 아닌가요? 환불 무조건 해주세요
731,732,20210502,2021,05,02,1,고인재,아니 일주일이넘게 결제 취소 삭제 다해도 이멜 연락도 없고 결국 13만원 정기결제되고 모하는거임?? 일안하시나요? 해지 신청만 몇번을 해야 되는건가요?? 절대쓰지마세요 별한개도 아까움
732,733,20191203,2019,12,03,4,Google 사용자,건강한 다이어트를 하고픈 분들께 추천합니다.칼로리 계산으로 식단관리가 편리하고 코치님들의 정보와 격려로 좌절하지않고 다디어트를 할수 있습니다.
733,734,20200715,2020,07,15,1,hyeonjeong suh,"저는 추천안합니다. 우선코칭 해주시는분 정말 성의없고 기계적이시더라구요. 질문에 답도 늦고요 S9인데 만보기 체크안되고, 돈 아까워서 머니백 미션 간신히 버텼네요."
734,735,20190921,2019,09,21,2,Google 사용자,만보기 사용하고 싶어 설치했는데... 걸음 수 측정이 잘 안되네요. 다른 기능들은 나름 괜찮음...
735,736,20200308,2020,03,08,3,Google 사용자,음식먹을때 좀더 조심할수있고 운동들도 따라할수 있는건 좋은데 만보기가 작동을 잘 안하네요....
736,737,20200929,2020,09,29,1,미니서수,솔까말 진심 귀찮아짐. 관리해주는 코치 잘 만나야 관리 잘해서 으쌰으쌰한다지만 내경우에는 잘못만나서 버린 케이스.AI랑 대화해도 이정도는 아닐듯
737,738,20210707,2021,07,07,1,박유희,환불부탁드립니다 지금 리뷰보니까 환불요청 한두개가 아닌데 처음 일주일 무료체험후에 1000원결제된후 승인취로 됬길래 가입안된줄알고 가만있었더니 오늘 9만원이 결제되고 이거 너무 하네요. 솔직히 한달에 5만원은 좀 아니지않나요 그리고 누가봐도 헷갈리게 1000원 취소되고 가입안된줄알고 가만있다가 이런식으로 환불요청이 한두개가 아닐것같은데 미리 7일되는 전날 문자라도 보내줘야 되는거 아닌가요?? 담날에 결제된다고 문자라도 보내줘야죠 이건아닌거같아요 이름 박유다 에요 얼른 카드취소 승인해주세요
738,739,20210217,2021,02,17,1,신동호,그룹도 매칭 안된체 물어보기 전까지 방치되고 코치와 연락도 4시간에 한번정도 됨. 코치가 오전 10시부터 6시까지 일하는걸 생각하면 하루에 2번이상 대화불가
739,740,20210315,2021,03,15,1,스마일,아니! 일주일동안 체험해보래서 보려고했는데 왜 이틀밖에 안됬는데 벌써 프로그램 결정하고 코치를 만나라고해요?? 대화 별로 해보지도 못하고 끝나버렸어요;;;;; 뭐 이런경우가 다있지
740,741,20190723,2019,07,23,5,Google 사용자,그냥 반신반의 하면서 도대체 내가 얼마나 먹길래 살이 찔까 그냥 파악하려고 시작했어요.. 솔직히 안해본 다이어트 없었는데 환급받으면서 6키로 정도 감량했네요 ㅎㅎ 24개월동안 6키로.. 어떻게 보면 적다고 생각할 수 있지만 조금씩 빼서 그런지 요요가 없다는게 좋은거 같아요 ㅎㅎ 무엇보다 이제 무의식적으로 칼로리를 조절해서 먹게 되고 아침을 먹게되는 등 식습관이 잡혀서 좋았어요 ㅎㅎ
741,742,20201008,2020,10,08,5,Seri Choi,벌써 16주 도전을 세 번 완료했어요 드라마틱한 감량은 아니지만 꾸준히 식단을 기록하는거랑 코치님의 코멘트가 좋아서 계속 합니다 만족해요
742,743,20210225,2021,02,25,1,Jay Chung,환불 신청했는데 확인까지 받았는데. 새벽에 바로 결제해가네요. 이런경우가 다 있나요. 불안하기 그지 없네요. 바로 환불해주세요
743,744,20201109,2020,11,09,5,연민경,휴대폰 및 웨어러블을 갤럭시제품으로 사용중인데요 삼성헬스에 만보기기록을 눔에도 공유할수있나요?
744,745,20210521,2021,05,21,5,주진혜,음식신호등에서 식단입력하지 않아도 바로 식단검색이 가능하면 좋겠어요.
745,746,20190722,2019,07,22,5,Google 사용자,체계적인 시스템에 더욱더 자신감이 생기고 필요한 주위 사람들이 있으면 꼭 알리겠습니다
746,747,20191109,2019,11,09,4,Google 사용자,머니백 시작한지 1주일 되었는데 아주 만족해요. 만보기가 정확하지 않은 거 빼고 다 좋아요.
747,748,20200317,2020,03,17,5,Google 사용자,눔과 함께했던 프로젝트 덕분에 건강한 몸 되찾고 자존감도 되찾았어요! 추천합니다
748,749,20191023,2019,10,23,5,Google 사용자,이제 한달 남짓.. 5키로 빠짐. 여지껏 해본 다이어트 프로그램 중에 제일 쉽고 효과적임
749,750,20191002,2019,10,02,1,Google 사용자,업데이트 후 실행이 안되고 강제 종료됩니다 s10 5g이고 지웠다가 다시 설치해도 오류가 계속됩니다
750,751,20210414,2021,04,14,1,cat,결제를 취소하려는데요 제가 원하는 프로그램도 아닌데 결제가 되었네요 취소하려니까 앱 실행도 되지 않고 해결해주셔요
751,752,20191001,2019,10,01,5,Google 사용자,"무조건적인 지시가 아닌, 과학적인 사실을 기반으로 한 효과적인 정보제공으로 다이어트나 건강한 생활을 할 수 있도록 지속적인 지지를 제공합니다."
752,753,20210715,2021,07,15,1,롯씬,저도 아무런 연락이나 문자한통도 받지못하고 결제만 됐네요 도대체 이게 뭔지 13만원 넘게 결제 되버렸어요 확인하고 환불해주세요
753,754,20210916,2021,09,16,1,forever_yeong,왜 제 리뷰만 계속 삭제되죠? 지금 세번째 씁니다. 앱들어가면 맞춤프로그램 만나러가기랑 초대코드가 있습니다 만 떠요. 앱삭제하고 다시 깔아도 그래요
754,755,20210504,2021,05,04,1,토실양양,방금 가입해서 결제했다가 해외결제되는 것 보고 깜짝 놀라서 환불신청했습니다 빨리 환불받고 싶네요 처리해주세요!!
755,756,20200216,2020,02,16,5,Google 사용자,음식에대한 올바른 생각을 갖게해주면서 건강한 다어어트와 유지할 수 있는 방법을 알려주네요
756,757,20210116,2021,01,16,1,k yj_0_,진짜..완전별로...;; 별로 1:1이라고..좋아했더니...코치 답 엄청 느리고 음식 데이터도 많이없어요 ..정말 별로 고객센터도 머니백 문의해도 메일 답도안옴;;
757,758,20200221,2020,02,21,1,Google 사용자,환불신청했고 정기결재도취소했는데 왜 환급도안해주시고 정기결제도 계속 나갑니까 대답해줄수있는고객센터는 자동 음성 으로 해놓고 사람 답답하게하시네요
758,759,20200202,2020,02,02,5,Google 사용자,드라마틱한 효과대신 지속가능한 효과를 볼 수 있는 다이어트 앱이네요!^^
759,760,20220525,2022,05,25,1,뚜딩,앱이 너무 무거워요... 어제부터 화면이 뜨질 않습니다 점검중이거나 오류인가요?
760,761,20210709,2021,07,09,3,최선경,어제새벽에 무료기간이 끝났는지 결제가 되었어요 오전에 메일로 이메일과 번호보내고 환불요청했는데요.. 환불이 되면 따로 오는걸까요?? 오늘안에 카드 취소되는건지 문의드립니다
761,762,20190820,2019,08,20,5,Google 사용자,"머니백 프로그램 4개월 참여했어요. 코치님이 있지만, 제가 직접 찾아가지 않아도 되니 시간적으로도 구애받지 않았고, 하다가 그만두는 그런 불상사도 발생하지 않았구요. 그리고 머니백 프로그램으로 동기부여도 되었습니다."
762,763,20200829,2020,08,29,1,방은지,몇 년전부터 체중조절 할때마다 눔 도움받았는데 이제는 무료 사용 불가네요.. 프로그램 유료 결제 안 하면 안넘어가는.. 왜 이렇게 변했나요.. 무료랑 유료를 적절히 활용하시지.. 결제 안하면 안 넘어가는 상술에 실망감과 안타까움이ㅠㅠ 그럼 저도 눔 사랑에서 갈아타야겠어요..
763,764,20191217,2019,12,17,5,Google 사용자,도움많이받은 앱~ 매일제공되는 정보도 퀄리티있고 매일매일 기록하면서 다이어트와 건강관리에 큰 도움받았습니다!!
764,765,20201111,2020,11,11,5,보라곰돌이,유료로사용중인데 엄청 빠진다라기보단 생활습관을 개선해주는데있어서 정말 좋은거같아요
765,766,20200707,2020,07,07,5,최현선,눔을 알기전 다이어트는 무조건 굶어야한다고 생각했어요 스트레스 받지않고 건강하게 식단 체크하는게 넘나 좋았네요^^
766,767,20200324,2020,03,24,4,Google 사용자,요요와 폭식이 익숙한 저에게 장기적으로 음식의 밀도의 개념을 알려주셔서 새롭게 알게된 것이 많은 도움이 됐습니다.
767,768,20210407,2021,04,07,1,임지윤,너무 렉걸려서 기본 설정 하는대만 20넘기 소요 되네요 여러번 강제종료후 재실행 해봐도 같네요
768,769,20190909,2019,09,09,5,Google 사용자,좋아요ㅎㅎ 시작한지 일주일만에 3키로뺐네요~균형잡힌 식사나 운동 목표잡을 수 있어서 너무좋아용^ㅇ^
769,770,20210801,2021,08,01,3,지아 (림),광고보고 가입했는데 딱히 필요가 없네요ㅠ 리뷰에 보이는 경로대로 계정에 들어가서 정기구독 취소와 환불 요청했는데 정확히 되었는지 확인가능할까요?
770,771,20200415,2020,04,15,5,Google 사용자,페이백 프로그램 두번해서 모두 성공했어요. 건강하게 체중 유지하고있어요.
771,772,20201015,2020,10,15,3,살충충동,운동기록이 수정 및 삭제되지 않고 실시간 운동기록도 뜨지 않습니다.
772,773,20200819,2020,08,19,4,V icky (flying colors),저는 눔머니백 2번째 사용자인데요~ 4개월 과정을 거쳤습니다. 100프로 환불은 아닌 것으로 알고있구요~ 코치님의 기계적인 응답이라하더라도 4개월동안 약 3만원정도의 관리서비스라면 받아볼만 하다고 생각합니다. 식단기록을 의무적으로 하게되고 스스로 관리할 수 있도록 느끼게 해주는 것 같구요 필요힌 부분은 코치님께 물어볼 수도 있는거구요~! 물론 오프라인 상담이 아니라서 제한적인게 있긴해요! 보다 더 전문적인 상담이 필요하다면 별도로 오프라인 상담사를 두는게 좋을 것같아요! 감사했습니다~!
773,774,20190101,2019,01,01,1,Google 사용자,"12월 28일 결제 후 고객센터와 상담하고 결제취소 요청을 했습니다. 고객센터에서는 월요일날 취소진행해준다고했고, 취소가 되지않아 다시 전화를 했더니 월요일 오후에 결제취소 해주겠다고 하였으나 왜 아직도 취소가 안되어 있죠? 이런식으로 업무처리 하나요? 결제할때 결제하자마자 시간상관없이 바로 고객센터에서 상담전화오더니 결제취소는 왜 이렇게 늦나요 빠른처리 부탁드립니다. 이런식으로 업무처리하시면 안되죠. 취소요청을 몇이나 해야하나요."
774,775,20220512,2022,05,12,1,황연희,눔 안드로이드 로그인시 창이 그냥 꺼집니다 다시 삭제하고 다운받아도 동일해요
775,776,20190716,2019,07,16,1,Google 사용자,버벅대고 도움 안되요 정말 이해하기 힘든 심리 언어만 나열해놓고 ㅡㅡ 운동도 별로고 코치도 별로고 차라리 저돈이면 다노를 추천해요
776,777,20210522,2021,05,22,5,백경희,앱 작성으로 먹는거 체중 운동등 더 신경쓰고 기록이 남아 많은 도움이 돼요
777,778,20200225,2020,02,25,5,Google 사용자,눔과 함께 16주간 식단 및 운동관리를 쉽게할 수 있었습니다. 모두 다이어트 화이팅!
778,779,20190827,2019,08,27,4,Google 사용자,체계적인 관리에 본인의 의지만 좀 더 추가된다면 좋은 결과를 얻을 수 있는 프로그램. 담당코디와 그룹원과의 소통이 도움됩니다.
779,780,20210324,2021,03,24,1,슈비슈비,최악의 앱이네요 도대체 카드번호만 세번이나 쓰게하고 응답이 없이 서버에문제만 있다고 하는걸 언제까지 봐야하나요 그리고 천원으로 일주일 경험하기 한다고 해놓고 버젓이 3개월 결제시키는건 뭐죠? 그것도 이해한다고 합시다 어찌저찌 다시 들어 갔더니 결제 내역은 어디에서도 볼수 없고 다시 정기결제 하라고 유도하고 정기 결제로 돌렸더니 응답이없고 뭘 어떡하라는 건가요 관리도 못하면서 카드번호나 알아내고 담당자연결은 열리지도 않고 취소처리했더니 한달 후에나 된다고 하고 어이가 없네요 한달후에취소처리 바르게 되지 않으면 소보원에 고발할겁니다
780,781,20201123,2020,11,23,5,윤혜정,행동심리학에 적용해서 서서히 나의 행동습관을 바꿔나갈수 있어서 매우 좋은프로그램이라 생각합니다.
781,782,20200901,2020,09,01,5,Juliet J,다이어트 뿐만이 아니라 건강한 식습관과 운동습관을 몸에 익히게 되었어요. 추천합니다.
782,783,20220120,2022,01,20,1,pitApat,뭔 로그인하고 자꾸 맞춤프로그램 보기만 들어가져요 이거 결제해야만 사용 가능한 건가요? 탈퇴하고 싶어도 안 들어가지는데요ㅡㅡ 정보만 가져가는 건가요
783,784,20210714,2021,07,14,5,조일우,4키로 빠졌습니다. 코치님의 피드백도 좋고요. 다만 일이 너무 바빠져서 앱을 신경쓸 시간이 없다보니 돈이 아까워 지우게 됐네요.ㅜㅜ
784,785,20191224,2019,12,24,4,Google 사용자,음식을 먹을때 신경을 써서 먹게되니 건강해지는거 같아요 ! 살은 많이 빠지진않았지만 그래도 다이어트가 되었어요~
785,786,20191029,2019,10,29,1,Google 사용자,"가이드라인이 정확 내용과 설명이 부족,,,코치님 답변도 너무 느리네요,,,"
786,787,20191108,2019,11,08,2,Google 사용자,어느날부터 앱을 누르면 켜지는 척 하다가 튕겨요 휴대폰기종은 노트10플러스 쓰고있습니다. 접속오류 고쳐주세요.
787,788,20190919,2019,09,19,5,Google 사용자,피드백을 해주시는 전담 코치님 덕에 규칙적인 생활 습관을 잡는데 아주 큰 도움이 되었습니다~ 눔 너무 고마워요!
788,789,20210613,2021,06,13,4,이욱선,식단 관리하는 방법이 마음에 들어요. 제한하는게 아니라 골고루 조절할수 있게 되어있어 좋아요
789,790,20201026,2020,10,26,1,루이비,앱설치가 안됩니다.눔 쓰는 사용자인데 걸음수 책정이 안되서 삭제하고 다시 눔 앱 설치 하려고 하니 안되네요.어떻게 된 걸까요
790,791,20210610,2021,06,10,2,Jin seo Rhee,폰 바꾸고 눔 업데이트하고 걸음수측정이 안되네요 권한설정도 알맞게한거 같은데ㅠ
